{"$schema":"https://json-schema.org/draft/2020-12/schema","title":"ENS Grant Decision Record","type":"object","required":["schemaVersion","recordId","program","application","governingPolicy","eligibility","evaluation","decision","disclosure","timestamps"],"properties":{"schemaVersion":{"type":"string","const":"0.1"},"recordId":{"type":"string","minLength":1},"recordType":{"type":"string","enum":["grant-decision","service-provider-decision","milestone-review"]},"program":{"type":"object","required":["name","roundId","authority"],"properties":{"name":{"type":"string"},"roundId":{"type":"string"},"authority":{"type":"string"},"programUri":{"type":"string","format":"uri"},"materialityTier":{"type":"string","enum":["A-simplified","B-standard","C-enhanced"]},"budgetCurrency":{"type":"string"}},"additionalProperties":false},"application":{"type":"object","required":["applicationId","applicantName"],"properties":{"applicationId":{"type":"string"},"applicantName":{"type":"string"},"applicationUri":{"type":"string","format":"uri"},"requestedAmount":{"type":"number","minimum":0},"currency":{"type":"string"},"confidential":{"type":"boolean"}},"additionalProperties":false},"governingPolicy":{"type":"object","required":["policyId","version","effectiveAt","sources"],"properties":{"policyId":{"type":"string"},"version":{"type":"string"},"effectiveAt":{"type":"string","format":"date-time"},"sources":{"type":"array","minItems":1,"items":{"type":"string","format":"uri"}},"changeDuringReview":{"type":"boolean"},"changeSummary":{"type":["string","null"]}},"additionalProperties":false},"eligibility":{"type":"object","required":["status","checkedAt","rules"],"properties":{"status":{"type":"string","enum":["pending","eligible","ineligible","waived"]},"checkedAt":{"type":"string","format":"date-time"},"rules":{"type":"array","items":{"type":"object","required":["ruleId","description","result"],"properties":{"ruleId":{"type":"string"},"description":{"type":"string"},"result":{"type":"string","enum":["pass","fail","pending","not-applicable"]},"evidenceIds":{"type":"array","items":{"type":"string"}}},"additionalProperties":false}},"rationale":{"type":["string","null"]}},"additionalProperties":false},"evaluators":{"type":"array","items":{"type":"object","required":["evaluatorId","kind","role"],"properties":{"evaluatorId":{"type":"string"},"displayName":{"type":"string"},"kind":{"type":"string","enum":["human","ai","committee","other"]},"role":{"type":"string"},"participated":{"type":"boolean"},"recused":{"type":"boolean"},"recusalReason":{"type":["string","null"]}},"additionalProperties":false}},"conflicts":{"type":"array","items":{"type":"object","required":["conflictId","subjectId","status"],"properties":{"conflictId":{"type":"string"},"subjectId":{"type":"string"},"description":{"type":"string"},"status":{"type":"string","enum":["disclosed","resolved","recused","unresolved"]},"resolution":{"type":["string","null"]}},"additionalProperties":false}},"evidence":{"type":"array","items":{"type":"object","required":["evidenceId","kind","description","disclosure"],"properties":{"evidenceId":{"type":"string"},"kind":{"type":"string","enum":["application","repository","onchain","forum","interview","document","metric","other"]},"description":{"type":"string"},"uri":{"type":"string","format":"uri"},"contentHash":{"type":"string"},"observedAt":{"type":"string","format":"date-time"},"disclosure":{"type":"string","enum":["public","selective-audit","confidential"]}},"additionalProperties":false}},"evaluation":{"type":"object","required":["criteria","materialFindings","disagreements"],"properties":{"criteria":{"type":"array","items":{"type":"object","required":["criterionId","name"],"properties":{"criterionId":{"type":"string"},"name":{"type":"string"},"weight":{"type":"number","minimum":0,"maximum":1},"score":{"type":["number","null"]},"scoreScale":{"type":["string","null"]},"findingIds":{"type":"array","items":{"type":"string"}}},"additionalProperties":false}},"materialFindings":{"type":"array","items":{"type":"object","required":["findingId","statement","classification","evidenceIds"],"properties":{"findingId":{"type":"string"},"statement":{"type":"string"},"classification":{"type":"string","enum":["supported-fact","judgment","uncertainty","unverified-claim","risk"]},"evidenceIds":{"type":"array","items":{"type":"string"}},"evaluatorIds":{"type":"array","items":{"type":"string"}},"materiality":{"type":"string","enum":["low","medium","high","critical"]}},"additionalProperties":false}},"disagreements":{"type":"array","items":{"type":"object","required":["disagreementId","issue","status"],"properties":{"disagreementId":{"type":"string"},"issue":{"type":"string"},"evaluatorIds":{"type":"array","items":{"type":"string"}},"status":{"type":"string","enum":["open","resolved","accepted-uncertainty"]},"resolution":{"type":["string","null"]}},"additionalProperties":false}},"aggregateScore":{"type":["number","null"]},"aggregateScale":{"type":["string","null"]}},"additionalProperties":false},"evaluatorManifest":{"type":["object","null"],"properties":{"manifestVersion":{"type":"string"},"commitment":{"type":["object","null"],"properties":{"algorithm":{"type":"string","enum":["sha256","sha3-256","other"]},"digest":{"type":"string"},"committedAt":{"type":"string","format":"date-time"}},"required":["algorithm","digest","committedAt"],"additionalProperties":false},"revealStatus":{"type":"string","enum":["not-applicable","committed","partially-revealed","revealed","withheld"]},"revealUri":{"type":["string","null"],"format":"uri"},"models":{"type":"array","items":{"type":"object","required":["provider","model"],"properties":{"provider":{"type":"string"},"model":{"type":"string"},"version":{"type":["string","null"]}},"additionalProperties":false}},"retrievalSources":{"type":"array","items":{"type":"string"}},"humanReviewPolicy":{"type":["string","null"]}},"additionalProperties":false},"decision":{"type":"object","required":["status","authority","decidedAt"],"properties":{"status":{"type":"string","enum":["pending","approved","rejected","deferred","withdrawn","suspended"]},"authority":{"type":"string"},"decidedAt":{"type":"string","format":"date-time"},"awardedAmount":{"type":["number","null"],"minimum":0},"currency":{"type":["string","null"]},"rationale":{"type":["string","null"]},"humanOverride":{"type":"boolean"},"overrideRationale":{"type":["string","null"]},"quorum":{"type":["string","null"]},"voteRecordUri":{"type":["string","null"],"format":"uri"}},"additionalProperties":false},"challenge":{"type":["object","null"],"properties":{"status":{"type":"string","enum":["not-open","open","submitted","resolved","expired"]},"deadline":{"type":["string","null"],"format":"date-time"},"scope":{"type":["string","null"]},"submissionUri":{"type":["string","null"],"format":"uri"},"resolution":{"type":["string","null"]}},"additionalProperties":false},"deliveryConditions":{"type":"array","items":{"type":"object","required":["conditionId","description","verificationMethod","status"],"properties":{"conditionId":{"type":"string"},"description":{"type":"string"},"targetDate":{"type":["string","null"],"format":"date"},"verificationMethod":{"type":"string"},"verifier":{"type":["string","null"]},"dependencies":{"type":"array","items":{"type":"string"}},"paymentAmount":{"type":["number","null"],"minimum":0},"currency":{"type":["string","null"]},"status":{"type":"string","enum":["pending","met","not-met","waived","revised"]},"evidenceIds":{"type":"array","items":{"type":"string"}},"consequence":{"type":["string","null"]}},"additionalProperties":false}},"disclosure":{"type":"object","required":["classification","publicRecord"],"properties":{"classification":{"type":"string","enum":["public","mixed","confidential"]},"publicRecord":{"type":"boolean"},"redactions":{"type":"array","items":{"type":"object","required":["field","basis"],"properties":{"field":{"type":"string"},"basis":{"type":"string","enum":["privacy","security","commercial","legal","contractual","other"]},"explanation":{"type":["string","null"]}},"additionalProperties":false}}},"additionalProperties":false},"timestamps":{"type":"object","required":["createdAt","updatedAt"],"properties":{"createdAt":{"type":"string","format":"date-time"},"updatedAt":{"type":"string","format":"date-time"}},"additionalProperties":false},"integrity":{"type":["object","null"],"properties":{"recordHashAlgorithm":{"type":"string"},"recordHash":{"type":"string"},"sourceCommit":{"type":"string"},"sourceUri":{"type":"string","format":"uri"}},"additionalProperties":false},"notes":{"type":"array","items":{"type":"string"}}},"additionalProperties":false}
