{"schemaVersion":"0.1","recordId":"illustrative-spp3-marketplace-rfp-pending","recordType":"service-provider-decision","program":{"name":"SPP3 Marketplace RFP","roundId":"marketplace-rfp-2026","authority":"SPP3 Committee under ENS DAO-approved Marketplace RFP","programUri":"https://discuss.ens.domains/t/marketplace-rfp-submission-timeline-and-artifacts/22309","materialityTier":"C-enhanced","budgetCurrency":"USD"},"application":{"applicationId":"illustrative-applicant","applicantName":"Illustrative Applicant — not a real submission","requestedAmount":400000,"currency":"USD","confidential":true},"governingPolicy":{"policyId":"SPP3-MARKETPLACE-RFP-2026","version":"published-2026-07-20","effectiveAt":"2026-07-20T21:48:00Z","sources":["https://discuss.ens.domains/t/7-1-social-spp3-marketplace-rfp/22263","https://discuss.ens.domains/t/marketplace-rfp-submission-timeline-and-artifacts/22309"],"changeDuringReview":false,"changeSummary":null},"eligibility":{"status":"pending","checkedAt":"2026-08-05T23:59:00Z","rules":[{"ruleId":"E1","description":"Operational ENS marketplace scope","result":"pending","evidenceIds":[]},{"ruleId":"E2","description":"Requested amount between $200,000 and $500,000","result":"pass","evidenceIds":[]},{"ruleId":"E3","description":"Live product or credible go-live path measured in weeks","result":"pending","evidenceIds":[]},{"ruleId":"E4","description":"Primary deliverable is a service to ENS","result":"pending","evidenceIds":[]},{"ruleId":"E5","description":"No active committee conflict under SPP3 standards","result":"pending","evidenceIds":[]},{"ruleId":"E6","description":"Applicant is not a ratified SPP3 cohort provider","result":"pending","evidenceIds":[]}],"rationale":"Illustrative record only. No real applicant eligibility determination is represented."},"evaluators":[{"evaluatorId":"committee","displayName":"SPP3 Committee","kind":"committee","role":"evaluation and award recommendation","participated":false,"recused":false,"recusalReason":null}],"conflicts":[],"evidence":[{"evidenceId":"POLICY-RFP","kind":"forum","description":"Public Marketplace RFP authorization, scope, award structure, evaluation approach, milestones, and committee rules.","uri":"https://discuss.ens.domains/t/7-1-social-spp3-marketplace-rfp/22263","observedAt":"2026-08-15T13:00:00Z","disclosure":"public"},{"evidenceId":"POLICY-RUBRIC","kind":"forum","description":"Binding Marketplace RFP timeline, eligibility gate, M1-M5 rubric, threshold, payment structure, and committee process.","uri":"https://discuss.ens.domains/t/marketplace-rfp-submission-timeline-and-artifacts/22309","observedAt":"2026-08-15T13:00:00Z","disclosure":"public"}],"evaluation":{"criteria":[{"criterionId":"M1","name":"Prior Delivery and Marketplace Impact","weight":0.25,"score":null,"scoreScale":"1–5 in 0.5 increments","findingIds":[]},{"criterionId":"M2","name":"Scope Clarity and Milestone Credibility","weight":0.2,"score":null,"scoreScale":"1–5 in 0.5 increments","findingIds":[]},{"criterionId":"M3","name":"Revenue and Adoption","weight":0.35,"score":null,"scoreScale":"1–5 in 0.5 increments","findingIds":[]},{"criterionId":"M4","name":"ENS Alignment and ENSv2 Readiness","weight":0.1,"score":null,"scoreScale":"1–5 in 0.5 increments","findingIds":[]},{"criterionId":"M5","name":"Post-Award Self-Sustainability","weight":0.1,"score":null,"scoreScale":"1–5 in 0.5 increments","findingIds":[]}],"materialFindings":[],"disagreements":[],"aggregateScore":null,"aggregateScale":"0–5; award threshold 3.0"},"evaluatorManifest":null,"decision":{"status":"pending","authority":"SPP3 Committee; subsequent ENS executable vote funds selected award","decidedAt":"2026-08-15T13:00:00Z","awardedAmount":null,"currency":"USD","rationale":"Illustrative pending record. No real committee judgment is represented.","humanOverride":false,"overrideRationale":null,"quorum":"Three of four Member seats under the published Marketplace RFP process","voteRecordUri":null},"challenge":{"status":"not-open","deadline":null,"scope":"Illustrative only; challenge procedure not inferred beyond published process.","submissionUri":null,"resolution":null},"deliveryConditions":[{"conditionId":"D1","description":"Go-live milestone with objective acceptance criteria.","targetDate":null,"verificationMethod":"Independent verification defined in award agreement; stream pauses if go-live is missed without approved revision.","verifier":"SPP3 accountability body / designated verifier","dependencies":[],"paymentAmount":null,"currency":"USD","status":"pending","evidenceIds":["POLICY-RFP","POLICY-RUBRIC"],"consequence":"Build stream may pause if required go-live milestone is missed."},{"conditionId":"D2","description":"Post-go-live traction gates tied to real marketplace usage.","targetDate":null,"verificationMethod":"On-chain or otherwise independently verifiable evidence such as attributed protocol revenue, active paying wallets, completed secondary sales with anti-wash filters, or retention.","verifier":"SPP3 accountability body / designated verifier","dependencies":["Final thresholds negotiated using baseline data at award signing."],"paymentAmount":null,"currency":"USD","status":"pending","evidenceIds":["POLICY-RFP","POLICY-RUBRIC"],"consequence":"Unreleased amounts return to the DAO treasury at term end."}],"disclosure":{"classification":"mixed","publicRecord":true,"redactions":[{"field":"application","basis":"commercial","explanation":"The live RFP states submissions are stored confidentially during review; this example uses a fictional applicant."}]},"timestamps":{"createdAt":"2026-08-15T13:00:00Z","updatedAt":"2026-08-15T13:00:00Z"},"integrity":null,"notes":["This is a non-evaluative worked example.","It does not identify, score, recommend, or reject any real Marketplace RFP applicant.","The public policy mapping is based on the RFP artifacts available as of 2026-08-15."]}
